<!DOCTYPE root>
<generator-config xmlns="http://minuteproject.sf.net/xsd/mp-config"
	xmlns:xs="http://www.w3.org/2001/XMLSchema-instance"
	xs:noNamespaceSchemaLocation="mp-config.xsd">
	<configuration>
		<conventions>
			<target-convention type="enable-updatable-code-feature" />
		</conventions>
		<model name="petshop" version="1.0" package-root="net.sf.mp.demo">

			<data-model>
				<driver groupId="org.apache.derby" artifactId="derby"
					version="10.8.1.2" />
				<fileSource name="petshop" dir="c:/MinuteProject/data">
				</fileSource>
				<!-- <dataSource> <driverClassName>org.apache.derby.jdbc.ClientDriver</driverClassName> 
					<url>jdbc:derby://localhost:1527/sample</url> <username>app</username> <password>app</password> 
					</dataSource> <schema>app</schema> -->
				<dataSource>
					<driverClassName>org.hsqldb.jdbcDriver</driverClassName>
					<url>jdbc:hsqldb:hsql://127.0.0.1:9001/petshop</url>
					<username>sa</username>
					<password></password>
				</dataSource>

				<primaryKeyPolicy oneGlobal="true">
					<primaryKeyPolicyPattern name="autoincrementPattern" />
				</primaryKeyPolicy>
			</data-model>
			<business-model>
				<generation-condition>
					<condition type="exclude" startsWith="DUAL"></condition>
					<condition type="exclude" startsWith="ID_GEN"></condition>
					<condition type="exclude" startsWith="SEQUENCE"></condition>
				</generation-condition>
				<business-package default="pet">
					<condition type="package" startsWith="PRODUCT" result="product"></condition>
					<condition type="package" startsWith="ITEM" result="product"></condition>
				</business-package>
				<enrichment>
					<conventions>
						<entity-naming-convention type="apply-strip-table-name-prefix"
							pattern-to-strip="SYS,FIN" />
						<reference-naming-convention
							type="apply-referenced-alias-when-no-ambiguity" is-to-plurialize="true"></reference-naming-convention>
					</conventions>
					<package name="product">
						<entity-group entities="PRODUCT"></entity-group>
						<entity-group entities="ITEM"></entity-group>
					</package>
					<entity name="TAG_ITEM" master-relationship-field="ITEMID" />
					<entity name="PRODUCT" alias="MY_GOOD_PRODUCT">
					</entity>
					<entity name="ITEM" alias="MY_GOOD_ITEM" comment="my item table">
						<field name="PRODUCTID" alias="THIS_IS_MY_PRODUCT" comment="my product field reference"></field>
					</entity>
					<entity name="CATEGORY" content-type="reference-data">
						<semantic-reference>
							<sql-path path="NAME" />
						</semantic-reference>
					</entity>
				</enrichment>
			</business-model>
		</model>
		<targets catalog-entry="REST-JEE">
<!-- 
			<target refname="JPA2" name="JPA2" fileName="catalog/mp-template-config-JPA2.xml"
				outputdir-root="../output/REST-JEE/petshop/JPA2" templatedir-root="../../template/framework/jpa">
				<property name="add-querydsl" value="2.1.2"></property>
				<property name="add-jpa2-implementation" value="eclipselink"></property>
				<property name="add-xmlbinding" value="true"></property>
				<property name="add-xml-format" value="lowercase-hyphen"></property>		< - - java-variable, uppercase-underscore, lowercase-hyphen, java-class - - >
			</target>

			<target name="REST" fileName="catalog/mp-template-config-REST.xml"
				outputdir-root="../output/REST-JEE/petshop/REST" templatedir-root="../../template/framework/rest"
				templatedir-ref="../../template/framework/ejb">
				<property name="add-rest-implementation-jersey-version"
					value="1.9-ea03"></property>
			</target>

			<target refname="LIB" fileName="catalog/mp-template-config-bsla-LIB-features.xml"
				templatedir-root="../../template/framework/bsla">
			</target>
			<target refname="CACHE-LIB" fileName="catalog/mp-template-config-CACHE-LIB.xml"
				templatedir-root="../../template/framework/cache">
			</target>
			<target refname="COMMON-LIB" fileName="catalog/mp-template-config-COMMON-LIB.xml"
				templatedir-root="../../template/framework/common">
			</target>
			<target refname="SPRING-LIB" fileName="catalog/mp-template-config-SPRING-LIB.xml"
				templatedir-root="../../template/framework/spring">
			</target>

			<target refname="MavenMaster" name="maven"
				fileName="catalog/mp-template-config-maven.xml" outputdir-root="../output/REST-JEE/petshop"
				templatedir-root="../../template/framework/maven">
			</target>

			<target refname="Documentation" fileName="catalog/mp-template-config-documentation.xml"
				outputdir-root="../output/REST-JEE/petshop" templatedir-root="../../template/template">
			</target>
 -->
		</targets>
	</configuration>
</generator-config>